Name,Word Count,Unique Count,Difficulty Score,Words Learnt with only this book,Words learnt if read twice,Average Sentence Length,Average Clause Length,Uncommon Words
EZEQUIEL.txt, 35596, 3966, 13003.484778787122, 392, 706, 13.159915356711004, 6.491685144124168, 2541
O SEGUNDO LIVRO DAS CHRONICAS.txt, 24184, 3108, 11726.222084024723, 278, 534, 14.212045793927327, 6.464988364713349, 1781
SEGUNDA EPISTOLA UNIVERSAL DO APOSTOLO S. PEDRO.txt, 1382, 621, 36496.01212934723, 16, 34, 14.704918032786885, 6.535836177474403, 255
O LIVRO DOS JUIZES.txt, 17203, 2657, 11815.71441293489, 211, 427, 11.644759206798867, 6.45373048004627, 1488
NAHUM.txt, 1206, 528, 26253.11936819948, 12, 34, 11.679389312977099, 6.33587786259542, 225
PROVERBIOS DE SALOMÃO.txt, 14372, 2788, 18872.931210564682, 151, 323, 11.467477203647416, 7.329521086490351, 1817
JONAS.txt, 1238, 456, 16223.442338261935, 15, 42, 11.23134328358209, 6.275862068965517, 143
O PRIMEIRO LIVRO DE MOYSÉS CHAMADO GENESIS.txt, 35635, 4206, 10159.861161392064, 386, 673, 11.308232118758434, 6.268178694158076, 2779
APOCALYPSE DO APOSTOLO S. JOÃO.txt, 11289, 1884, 14196.300625223292, 150, 296, 12.05119735755574, 6.419171405361495, 913
PRIMEIRA EPISTOLA DE S. PAULO APOSTOLO AOS CORINTHIOS.txt, 8686, 1796, 17031.712108731026, 123, 223, 10.504094631483166, 5.9801324503311255, 1007
O SANCTO EVANGELHO SEGUNDO S. JOÃO.txt, 17080, 2478, 9175.798994683442, 239, 447, 9.321546052631579, 5.84968538802144, 1228
O PRIMEIRO LIVRO DE SAMUEL.txt, 23426, 3251, 10450.64321165593, 261, 487, 11.537037037037036, 6.426402361872627, 1930
HABACUC.txt, 1387, 590, 25501.61165728494, 14, 36, 11.551020408163266, 6.705454545454545, 232
LAMENTAÇÕES DE JEREMIAS.txt, 3203, 1060, 18850.627805990913, 41, 86, 8.597077244258873, 6.169127516778524, 505
O LIVRO DE ESTHER.txt, 5385, 1076, 18185.048058844295, 69, 145, 16.141752577319586, 7.0971184631803625, 470
JEREMIAS.txt, 38678, 4830, 14237.101844975601, 366, 694, 12.532767312284426, 6.145800698879383, 3261
ZACHARIAS.txt, 5788, 1341, 14336.276393426033, 80, 154, 11.936170212765957, 6.526011560693641, 578
JOEL.txt, 1850, 636, 18095.441854837354, 24, 52, 11.136363636363637, 6.011261261261262, 252
O SEGUNDO LIVRO DE SAMUEL.txt, 19100, 2958, 11787.684096420093, 224, 410, 11.726245505906522, 6.1818862275449105, 1685
O SEGUNDO LIVRO DOS REIS.txt, 21442, 2743, 9192.64375499633, 265, 479, 12.330735509011204, 6.065381205673759, 1467
EPISTOLA DE S. PAULO AOS ROMANOS.txt, 8931, 1820, 16476.90073457017, 125, 237, 10.698214285714286, 6.157424812030075, 995
O SEGUNDO LIVRO DE MOYSÉS CHAMADO EXODO.txt, 29151, 3376, 9216.009132587003, 343, 644, 12.454513645906228, 6.653746322893234, 2011
SEGUNDA EPISTOLA DE S. PAULO APOSTOLO AOS CORINTHIOS.txt, 5605, 1373, 25417.78220587368, 74, 161, 13.001798561151078, 6.27741935483871, 741
EPISTOLA DE S. PAULO APOSTOLO AOS GALATAS.txt, 2865, 881, 21846.851447020723, 39, 92, 11.33529411764706, 6.175257731958763, 398
ISAIAS.txt, 34275, 5588, 19542.77459425886, 329, 638, 12.078192875760209, 6.473337155963303, 3998
TERCEIRA EPISTOLA DO APOSTOLO S. JOÃO.txt, 281, 165, 24686.40432097798, 1, 8, 10.636363636363637, 6.079365079365079, 42
O LIVRO DE ESDRAS.txt, 6764, 1457, 20851.97786242461, 88, 184, 14.800738007380074, 5.693484042553192, 746
EPISTOLA DE S. PAULO APOSTOLO A TITO.txt, 907, 439, 41156.30398814325, 8, 23, 12.4, 5.649789029535865, 202
OSEAS.txt, 4654, 1344, 16440.650801011387, 66, 111, 10.5, 6.135208711433757, 636
EPISTOLA DE S. PAULO APOSTOLO AOS EPHESIOS.txt, 2884, 848, 20928.996943220314, 44, 87, 13.112211221122113, 6.399700598802395, 370
LIVRO DO ECCLESIASTES  OU PRÉGADOR.txt, 5528, 1244, 16471.152163243707, 76, 161, 13.241035856573705, 7.540084388185654, 568
EPISTOLA DE S. PAULO APOSTOLO AOS HEBREOS.txt, 6374, 1677, 27974.87461080328, 86, 184, 13.918196994991654, 6.327903682719547, 877
O PRIMEIRO LIVRO DOS REIS.txt, 22755, 2904, 9468.739226783644, 276, 513, 12.608108108108109, 6.3871391076115485, 1590
O QUARTO LIVRO DE MOYSÉS CHAMADO NUMEROS.txt, 28946, 3195, 9546.316586193938, 370, 610, 12.614576033637, 6.4223140495867765, 1873
PRIMEIRA EPISTOLA UNIVERSAL DO APOSTOLO S. PEDRO.txt, 2297, 826, 30129.545606199357, 30, 66, 12.04313725490196, 5.948121645796064, 413
O LIVRO DE JOB.txt, 17096, 3628, 19035.715017666585, 198, 356, 10.507782101167315, 6.946271285965943, 2421
PRIMEIRA EPISTOLA DE S. PAULO APOSTOLO A TIMOTHEO.txt, 2225, 820, 33049.67531115867, 23, 72, 12.277551020408163, 6.011090573012939, 415
MIQUEAS.txt, 2805, 943, 18413.128871524266, 42, 83, 11.379746835443038, 6.475165562913907, 400
CANTARES DE SALOMÃO.txt, 2595, 822, 28308.82912766045, 36, 81, 12.414342629482071, 6.54863813229572, 414
SEGUNDA EPISTOLA DE S. PAULO APOSTOLO AOS THESSALONICENSES.txt, 991, 393, 24802.7746310985, 19, 28, 14.297872340425531, 6.778301886792453, 136
AMÓS.txt, 3751, 1083, 18076.797196079664, 48, 99, 12.26943005181347, 6.322222222222222, 472
O PRIMEIRO LIVRO DAS CHRONICAS.txt, 19578, 3087, 17402.09303333913, 213, 421, 12.731318681318681, 5.2280334728033475, 1952
O LIVRO DOS PSALMOS.txt, 41326, 5723, 15356.911373328205, 386, 764, 10.611729452054794, 6.874794069192752, 4203
DANIEL.txt, 10881, 1891, 15584.72739868743, 138, 314, 14.045793397231098, 6.185201401050788, 931
MALACHIAS.txt, 1664, 555, 15758.80803369759, 26, 47, 10.680203045685278, 6.3535911602209945, 196
SOFONIAS.txt, 1467, 548, 21709.3434225077, 19, 42, 12.556291390728477, 6.474683544303797, 209
EPISTOLA DE S. PAULO APOSTOLO A PHILEMON.txt, 435, 227, 21136.666915759368, 5, 13, 11.745098039215685, 6.180952380952381, 66
AGGEO.txt, 1069, 360, 13465.43993396528, 11, 29, 12.185185185185185, 5.270370370370371, 90
O SANCTO EVANGELHO SEGUNDO S. MATTHEUS.txt, 21043, 3721, 15272.260079544125, 267, 514, 9.86983546617916, 5.397240377632534, 2338
EPISTOLA DE S. PAULO APOSTOLO AOS PHILIPPENSES.txt, 2115, 704, 25390.97734251944, 30, 60, 13.419811320754716, 6.47457627118644, 299
PRIMEIRA EPISTOLA DE S. PAULO APOSTOLO AOS THESSALONICENSES.txt, 1851, 591, 21407.858204080752, 26, 55, 10.923728813559322, 5.89727463312369, 255
ACTOS DOS APOSTOLOS.txt, 21485, 3789, 21993.279424715987, 285, 513, 12.043310463121784, 5.709780364182467, 2481
EPISTOLA UNIVERSAL DO APOSTOLO S. JUDAS.txt, 588, 339, 35961.457384416884, 4, 12, 12.215384615384615, 5.644736842105263, 121
O TERCEIRO LIVRO DE MOYSÉS CHAMADO LEVITICO.txt, 21196, 2113, 8466.262901959499, 290, 480, 13.420362903225806, 6.703139643861293, 1188
PRIMEIRA EPISTOLA UNIVERSAL DO APOSTOLO S. JOÃO.txt, 2353, 476, 11046.683850653768, 36, 87, 11.064056939501778, 6.567829457364341, 166
O QUINTO LIVRO DE MOYSÉS CHAMADO DEUTERONOMIO.txt, 25187, 3445, 12181.56943208437, 269, 512, 13.135510204081633, 6.720411331005045, 2115
SEGUNDA EPISTOLA DO APOSTOLO S. JOÃO.txt, 293, 163, 21309.26174394838, 2, 7, 11.617647058823529, 6.294117647058823, 43
O SANCTO EVANGELHO SEGUNDO S. LUCAS.txt, 22792, 4041, 15376.276552791505, 266, 531, 9.990291262135923, 5.440267765190526, 2594
OBADIAS.txt, 571, 267, 21823.747439091658, 9, 16, 12.56140350877193, 6.954954954954955, 82
O SANCTO EVANGELHO SEGUNDO S. MARCOS.txt, 13235, 2679, 13895.9414285436, 176, 351, 9.649737302977233, 5.198860398860399, 1527
EPISTOLA UNIVERSAL DO APOSTOLO S. THIAGO.txt, 2196, 834, 27907.35686849203, 24, 59, 11.464, 6.072124756335283, 379
O LIVRO DE RUTH.txt, 2305, 698, 13233.57188756936, 32, 88, 10.558490566037737, 5.945631067961165, 256
O LIVRO DE JOSUÉ.txt, 17263, 2472, 13153.214717100998, 205, 399, 13.115960099750623, 6.079752953813104, 1417
SEGUNDA EPISTOLA DE S. PAULO APOSTOLO A TIMOTHEO.txt, 1597, 708, 40447.88952978523, 19, 40, 12.875, 6.297297297297297, 344
EPISTOLA DE S. PAULO APOSTOLO AOS COLOSSENSES.txt, 1960, 656, 25948.9765297178, 29, 61, 12.788461538461538, 6.1260683760683765, 292
O LIVRO DE NEHEMIAS.txt, 9547, 2009, 20148.543172563972, 120, 251, 13.341013824884792, 5.374352331606218, 1112
